{
  "schema": 2,
  "seq": 9,
  "state": "running",
  "writtenAt": "2026-01-01T12:00:00Z",
  "modVersion": "0.2.0",
  "build": 100001,
  "dlcIds": [
    "DLC_ALPHA_ID"
  ],
  "colonyName": "Synth Colony",
  "colonyGuid": "00000000-0000-0000-0000-000000000001",
  "cycle": 12,
  "timeOfDay": 0.42,
  "paused": false,
  "speed": 2,
  "activeWorldId": 0,
  "writeMs": 0.8,
  "worlds": [
    {
      "id": 0,
      "name": "Home Asteroid",
      "isStarter": true,
      "dupes": [
        {
          "id": "d1",
          "name": "Ada",
          "stress": 15,
          "health": {
            "value": 100,
            "max": 100
          },
          "calories": {
            "value": 3200,
            "max": 4000
          },
          "breath": {
            "value": 100,
            "max": 100
          },
          "bladder": 10,
          "morale": {
            "value": 12,
            "required": 8
          },
          "chore": "Dig",
          "skills": [
            "SynthDigging1"
          ],
          "traits": [
            "SynthQuick"
          ],
          "assignedSkill": "SynthDigging1",
          "appearanceHash": "ab12cd34",
          "statusItems": [
            {
              "id": "SynthHungry",
              "name": "Hungry",
              "severity": "minorBad"
            },
            {
              "id": "SynthCozy",
              "name": "Cozy",
              "severity": "good"
            }
          ],
          "diseases": [],
          "stamina": {
            "value": 80,
            "max": 100
          },
          "bodyTempC": 37.0,
          "attributes": [
            {
              "id": "SynthDigging",
              "name": "Digging",
              "value": 7
            },
            {
              "id": "SynthAthletics",
              "name": "Athletics",
              "value": 3
            }
          ]
        },
        {
          "id": "d2",
          "name": "Bo",
          "stress": 40,
          "health": {
            "value": 100,
            "max": 100
          },
          "calories": {
            "value": 3200,
            "max": 4000
          },
          "breath": {
            "value": 100,
            "max": 100
          },
          "bladder": 10,
          "morale": {
            "value": 12,
            "required": 8
          },
          "chore": null,
          "skills": [
            "SynthDigging1"
          ],
          "traits": [
            "SynthQuick"
          ],
          "assignedSkill": "SynthDigging1",
          "appearanceHash": "0f0f0f0f",
          "statusItems": [
            {
              "id": "SynthSuffocating",
              "name": "Suffocating",
              "severity": "bad"
            },
            {
              "id": "SynthStressed",
              "name": "Stressed",
              "severity": "bad"
            }
          ],
          "diseases": [
            {
              "id": "SynthSlimeLung",
              "name": "Slimelung"
            }
          ],
          "stamina": {
            "value": 20,
            "max": 100
          },
          "bodyTempC": 38.6,
          "attributes": []
        }
      ],
      "resources": [
        {
          "id": "SynthWidgetium",
          "name": "Synth Widgetium",
          "category": "Metal",
          "amount": 1200.5,
          "unit": "kg"
        },
        {
          "id": "SynthOre",
          "name": "Synth Ore",
          "category": "Metal",
          "amount": 300,
          "unit": "kg"
        },
        {
          "id": "SynthBar",
          "name": "Synth Bar",
          "category": "Food",
          "amount": 12,
          "unit": "units",
          "kcal": 2400
        },
        {
          "id": "SynthBeast",
          "name": "Synth Beast",
          "category": "Critters",
          "amount": 4,
          "unit": "units"
        }
      ],
      "critters": [
        {
          "id": "SynthBeast",
          "count": 4,
          "tame": 4,
          "eggs": 1
        }
      ],
      "alerts": [
        {
          "id": "a1",
          "level": "bad",
          "text": "Low air",
          "cycle": 12,
          "count": 2,
          "title": "Low air (2)",
          "type": "bad",
          "tooltipMarkup": "<b>Low air</b>\n<link=\"0\"><color=#F48C8C>Ada</color></link> is holding her breath\n<link=\"1\"><color=#F48C8C>Bea</color></link> is short of oxygen\n<sprite name=\"oxygen\"> Build an oxygen source",
          "links": [
            {
              "index": 0,
              "label": "Ada is holding her breath",
              "kind": "focus",
              "target": "Ada"
            },
            {
              "index": 1,
              "label": "Bea is short of oxygen",
              "kind": "focus",
              "target": "Bea"
            }
          ],
          "click": {
            "kind": "focus"
          },
          "dismissable": false
        },
        {
          "id": "a2",
          "level": "warning",
          "text": "No Research Focus",
          "cycle": 12,
          "count": 1,
          "title": "No Research Focus",
          "type": "minorBad",
          "tooltipMarkup": "<b>No Research Focus</b>\nSelect a research focus to continue researching.",
          "links": [],
          "click": {
            "kind": "screen",
            "target": "research"
          },
          "dismissable": false
        },
        {
          "id": "a3",
          "level": "info",
          "text": "Synthetic reminder",
          "cycle": 12,
          "count": 1,
          "title": "Synthetic reminder",
          "type": "neutral",
          "tooltipMarkup": "A reminder that <color=#98A2B3>can be dismissed</color>.",
          "links": [],
          "click": {
            "kind": "none"
          },
          "dismissable": true
        }
      ],
      "research": {
        "current": {
          "tech": "SynthWidgetry",
          "points": {
            "synth_basic": 5
          },
          "cost": {
            "synth_basic": 15
          }
        },
        "queue": [
          {
            "tech": "SynthWidgetry",
            "points": {
              "synth_basic": 5
            },
            "cost": {
              "synth_basic": 15
            }
          }
        ],
        "completed": []
      },
      "power": [
        {
          "id": 1,
          "generatedW": 800,
          "consumedW": 300,
          "batteryJ": 1000,
          "batteryMaxJ": 4000,
          "overloaded": false
        }
      ]
    }
  ]
}
